"id";"condition";"category";"sector";"text1";"text2";"comment"
"4a-v-land";"rule_4a-i-ag || rule_2b-ii-for";"Increase in Hot and Dry Conditions";"Land Use Planning";"Possible increase in dry & hot summers";"<ul><li>Local government wildfire planning required.</li><li>Summer wildfire response may result in park closures resulting in decrease in tourist economy.</li><li>Possible reduction of recreation services.</li><li>Industrial/commercial, residential and agriculture demands may exacerbate scarce summer water supplies.</li><li>Review water management engage water users reduce water usage and manage service levels.</li><li>Consider impact on tourism related to rafting, fishing, recreation at lakes.</li><li>Update Urban Forestry Management Plan.</li><li>Wildfires may increase in frequency and intensity.</li><li>Consider native species heat and drought tolerance.</li><li>Review management of invasive plants.</li><li>Consider planting of vegetation that will endure future climatic changes.</li><li>Consider tree planting to reduce heat island effects and improve streetscape.</li></ul>";"Riparian zone peak flows in a hot and dry spiel? Come on..."
"4b-i-for";"rule_snow && (pass_djf_iamean_smean_e75p < 0 || pass_mam_iamean_smean_e75p < 0) && (nffd_djf_iamean_smean_e25p > 0 || nffd_mam_iamean_smean_e25p > 0)";"Decrease in Snowpack";"Forestry";"Possible shorter snow on ground period";"<ul><li>Possible shorter winter logging season.</li><li>Possible decrease in days/weeks of likely work in the woods.</li><li>Possible increase in log stockpiling needs for mills.</li></ul>";
"4b-ii-bio";"rule_4b-i-for";"Decrease in Snowpack";"Biodiversity";"Possible decrease in snowpack";"<ul><li>Alpine, subalpine species range will possibly move up slope.</li><li>Species may become locally extinct at lower elevations.</li></ul>";
"4b-iii-land";"rule_4b-i-for";"Decrease in Snowpack";"Land Use Planning";"Possible reduced snowfall";"Consider negative impacts on key industries related to climatic changes, e.g. ski hills resorts and back country recreation.";
"5a-i-bio";"(temp_djf_iamean_smean_e25p > 0) || (temp_jja_iamean_smean_e25p > 0) || (rule_snow ? (((prec_djf_iamean_smean_e25p / 100) * prec_djf_iamean_smean_hist) > prec_djf_iastddev_smean_hist) : (((prec_ann_iamean_smean_e25p / 100) * prec_ann_iamean_smean_hist) > prec_ann_iastddev_smean_hist))";"Change in Species Range";"Biodiversity";"Possible change in species range";"<ul><li>Possible disruption of species interactions.</li><li>Possible change in amount and timing of use of different parts of species' range (eg summer vs. winter areas).</li><li>Possible increasing invasion by exotic species (also expansion of range of impact of exotic species).</li><li>Possible changes in populations of pollinators (ripple effect on biodiversity &amp; agriculture).</li><li>Possible changes in climate related plant and animal patterns such as; flowering breeding mating and migrating.</li><li>Possible productivity changes.</li><li>Possible change in behaviour of species.</li><li>Possible extinction/extirpation and/or hyperabundance.</li><li>Incidence of human/wildlife conflict may increase.</li><li>Possible change in winter migration patterns (location, timing); potentially, species will cease migrating.</li></ul>";
"5a-ii-ag";"rule_5a-i-bio";"Change in Species Range";"Agriculture";"Climate suitability range shifts";"Possibility of increased success of pests, increase in range of invasive species;<ul><li>Consider current cultivars and livestock breeds.</li><li>Production systems may need to be re-evaluated and alternatives explored.</li><li>Consider need for monitoring.</li><li>Consider response/management planning for pests diseases and weeds.</li><li>Consider options for improving resilience of agricultural production to pests diseases weeds</li></ul>Consider how to deal expeditiously with invasive species that are new to an area:<ul><li>Consider impacts of shifting species ranges and migration patterns, and  increasing wildlife activity on agricultural crop productivity and quality.</li><li>Possible increased wildlife activity and changing migration patterns of birds can increase crop damage.</li></ul>";
"5a-iii-for";"(temp_jja_iamean_smean_e25p > 0) && (prec_jja_iamean_smean_e25p > 5)";"Change in Species Range";"Forestry";"Foliar and stem rusts more likely in pine plantations";"<ul><li>Select appropriate tree species for planting.</li><li>Consider planting less pine in these locations.</li></ul>";
"5b-i-for";"((rule_snow && (dg05_jja_iamean_smean_e25p > 0) && (prec_jja_iamean_smean_e25p > 5)) || (rule_shm < 60 && ((dg05_jja_iamean_smean_e75p / dg05_jja_iamean_smean_hist) < 0.05) && (prec_jja_iamean_smean_e25p > 0)))";"Possible Change in Productivity";"Forestry";"Forest productivity may increase";"<ul><li>Possible forest productivity increase.</li><li>Potential growth of yield to timber supply.</li></ul>";"Does not take into account losses due to drought events, disturbances."
"5b-ii-ag";"( ((dg05_jja_iamean_smean_e25p > 0)?1:0) + ((nffd_mam_iamean_smean_e25p  > 0)?1:0) + ((nffd_jja_iamean_smean_e25p > 0)?1:0) + ((nffd_son_iamean_smean_e25p > 0)?1:0) ) >= 3";"Possible Change in Productivity";"Agriculture";"Possible increase in growing season";"<ul><li>May be opportunities for increased productivity.</li><li>Possible longer production season.</li><li>Consider new crops and varieties that can be grown.</li><li>Possible range of southerly crops may expand; but consider effects of potential increased spring rainfall.</li></ul>";
